Nom,Ville,Email,Téléphone,Site Web,Adresse,Formations
IT-CNAM Paris,Paris,Non trouvé,Non trouvé,Non trouvé,,
"IUT site de Mont-Saint-Aignan, Université de Rouen",Rouen,Non trouvé,Non trouvé,Non trouvé,,
"IUT site d'Elbeuf, Université de Rouen",Rouen,Non trouvé,Non trouvé,Non trouvé,,
"IUT Robert Schuman, Université de Strasbourg",Strasbourg,Non trouvé,Non trouvé,Non trouvé,,
"IUT Paul Sabatier d'Auch, Université Toulouse III",Auch,Non trouvé,Non trouvé,Non trouvé,,
"IUT Paris Descartes, Université Paris Descartes",Paris,Non trouvé,Non trouvé,Non trouvé,,
"IUT Périgueux Bordeaux IV, Université Bordeaux IV",Périgueux,Non trouvé,Non trouvé,Non trouvé,,
"IUT 2, Université Grenoble Alpes (COMUE)",Grenoble,Non trouvé,Non trouvé,Non trouvé,,
"IUT site Pasteur, Université de Rouen",Rouen,Non trouvé,Non trouvé,Non trouvé,,
"IUT 1, Université Joseph Fourier - Grenoble 1",Grenoble,Non trouvé,Non trouvé,Non trouvé,,
"IUT Paul Sabatier de Castres, Université Toulouse III",Albi,Non trouvé,Non trouvé,Non trouvé,,
"IUT Nancy-Charlemagne, Nancy-Université - Nancy 2",Nancy,Non trouvé,Non trouvé,Non trouvé,,
"IUT Nancy-Brabois site de Vandoeuvre, Nancy-Université - Université Henri Poincaré",Nancy,Non trouvé,Non trouvé,Non trouvé,,
"IUT Lyon 1 (site La Doua), Université Claude Bernard - Lyon 1",Villeurbanne,Non trouvé,Non trouvé,Non trouvé,,
"IUT Lyon 1 (site Gratte-ciel), Université Claude Bernard - Lyon 1",Lyon,Non trouvé,Non trouvé,Non trouvé,,
"IUT Nancy-Brabois site de Lunéville, Nancy-Université - Université Henri Poincaré",Lunéville,Non trouvé,Non trouvé,Non trouvé,,
"IUT Nancy-Brabois - site de Villers, Nancy-Université - Université Henri Poincaré",Villers,Non trouvé,Non trouvé,Non trouvé,,
"IUT Michel de Montaigne Gradignan, Université Bordeaux III",Bordeaux,Non trouvé,Non trouvé,Non trouvé,,
"infocom 1 et 2 - IUT Michel de Montaigne Bordeaux, Université Bordeaux III",Bordeaux,Non trouvé,Non trouvé,Non trouvé,,
"IUT Lyon 1 (antenne de Bourg) - Département génie thermique et énergie, Université Claude Bernard - Lyon 1",Bourg-en-Bresse,Non trouvé,Non trouvé,Non trouvé,,
"IUT Louis Pasteur, Université de Strasbourg",Strasbourg,Non trouvé,Non trouvé,Non trouvé,,
"IUT Jean Moulin, Université Jean Moulin - Lyon 3",Lyon,Non trouvé,Non trouvé,Non trouvé,,
"IUT Luminy - antenne de l'IUT d'Aix-en-Provence, Université Aix-Marseille II",Marseille,Non trouvé,Non trouvé,Non trouvé,,
"IUT du Limousin, site de Tulle, Université de Limoges",Tulle,Non trouvé,Non trouvé,Non trouvé,,
"IUT Lumière, Université Lumière - Lyon 2",Lyon,Non trouvé,Non trouvé,Non trouvé,,
"IUT Lyon 1 (antenne de Bourg) - Département génie biologique, Université Claude Bernard - Lyon 1",Bourg-en-Bresse,Non trouvé,Non trouvé,Non trouvé,,
"IUT d'Évry (site Romero), Université d'Evry-Val-d'Essonne",Évry,Non trouvé,Non trouvé,Non trouvé,,
"IUT du Mans, Université du Mans",Le Mans,Non trouvé,Non trouvé,Non trouvé,,
"IUT du Limousin, site de Limoges, Université de Limoges",Limoges,Non trouvé,Non trouvé,Non trouvé,,
"IUT Lyon 1 (antenne de Bourg) - Département informatique et GEA, Université Claude Bernard - Lyon 1",Bourg-en-Bresse,Non trouvé,Non trouvé,Non trouvé,,
"IUT Henri Poincaré de Longwy, Nancy-Université - Université Henri Poincaré",Cosnes-et-Romain,Non trouvé,Non trouvé,Non trouvé,,
"IUT du Limousin, site de La Souterraine, Université de Limoges",Guéret,Non trouvé,Non trouvé,Non trouvé,,
"IUT du Limousin, site d'Egletons, Université de Limoges",Tulle,Non trouvé,Non trouvé,Non trouvé,,
"IUT TC - IUT Département techniques de commercialisation (annexe de Poitiers), Université de Poitiers",Poitiers,Non trouvé,Non trouvé,Non trouvé,,
"IUT SRC - IUT Département services et réseaux de communication, Université de Poitiers",Angoulême,Non trouvé,Non trouvé,Non trouvé,,
"IUT STID - IUT Département STatistique et Informatique Décisionnelle (annexe de Poitiers), Université de Poitiers",Niort,Non trouvé,Non trouvé,Non trouvé,,
"IUT du Limousin, site de Brive, Université de Limoges",Tulle,Non trouvé,Non trouvé,Non trouvé,,
"IUT RT - IUT Département réseaux et télécommunications (annexe de Poitiers), Université de Poitiers",Poitiers,Non trouvé,Non trouvé,Non trouvé,,
"IUT HSE - IUT Département hygiène, sécurité, environnement (annexe de Poitiers), Université de Poitiers",Niort,Non trouvé,Non trouvé,Non trouvé,,
"IUT GTE - IUT Département génie thermique et énergie, Université de Poitiers",Poitiers,Non trouvé,Non trouvé,Non trouvé,,
"IUT GMP - IUT Département génie mécanique et productique, Université de Poitiers",Poitiers,Non trouvé,Non trouvé,Non trouvé,,
"IUT GMP - IUT Département génie mécanique et productique, Université de Poitiers",Angoulême,Non trouvé,Non trouvé,Non trouvé,,
"IUT GEII - IUT Département génie électrique et informatique industrielle, Université de Poitiers",Poitiers,Non trouvé,Non trouvé,Non trouvé,,
"IUT GEII - IUT Département génie électrique et informatique industrielle, Université de Poitiers",Angoulême,Non trouvé,Non trouvé,Non trouvé,,
"IUT TC - IUT Département techniques de commercialisation, Université de Poitiers",Angoulême,Non trouvé,Non trouvé,Non trouvé,,
"IUT GC - IUT Département génie civil, Université de La Rochelle",La Rochelle,Non trouvé,Non trouvé,Non trouvé,,
"IUT GEA - IUT Département gestion des entreprises et des administrations, Université de Poitiers",Poitiers,Non trouvé,Non trouvé,Non trouvé,,
"IUT GEA - IUT Département gestion des entreprises et des administrations (annexe de Poitiers), Université de Poitiers",Niort,Non trouvé,Non trouvé,Non trouvé,,
"IUT CHIMIE - IUT Département Chimie, Université de Poitiers",Poitiers,Non trouvé,Non trouvé,Non trouvé,,
"IUT d'Orsay, Université Paris-Sud 11",Évry-Courcouronnes,Non trouvé,Non trouvé,Non trouvé,,
"IUT d'Orléans, Université d'Orléans",Orléans,Non trouvé,Non trouvé,Non trouvé,,
"IUT GB - IUT Département génie biologique, Université de La Rochelle",La Rochelle,Non trouvé,Non trouvé,Non trouvé,,
"IUT RT - IUT Département réseaux et télécommunications, Université de La Rochelle",La Rochelle,Non trouvé,Non trouvé,Non trouvé,,
"IUT d' Issoudun, Université d'Orléans",Issoudun,Non trouvé,Non trouvé,Non trouvé,,
"IUT d'Evry (site Les passages), Université d'Evry-Val-d'Essonne",Évry,Non trouvé,Non trouvé,Non trouvé,,
"IUT MP - IUT Département mesures physiques (annexe de Poitiers), Université de Poitiers",Poitiers,Non trouvé,Non trouvé,Non trouvé,,
"IUT d'Evry (site Juvisy-sur-Orge), Université d'Evry-Val-d'Essonne",Évry-Courcouronnes,Non trouvé,Non trouvé,Non trouvé,,
"IUT du Havre, Université du Havre",Rouen,Non trouvé,Non trouvé,Non trouvé,,
"IUT INFO - IUT Département informatique, Université de La Rochelle",La Rochelle,Non trouvé,Non trouvé,Non trouvé,,
"IUT d'Evry (site Brétigny), Université d'Evry-Val-d'Essonne",Bretigny,Non trouvé,Non trouvé,Non trouvé,,
"IUT Département qualité logistique industrielle et organisation, Université de Poitiers",Angoulême,Non trouvé,Non trouvé,Non trouvé,,
IUT de Vélizy (antenne de Rambouillet),Versailles,Non trouvé,Non trouvé,Non trouvé,,
"IUT d'Evreux, Université de Rouen",Évreux,Non trouvé,Non trouvé,Non trouvé,,
"IUT d'Evry (département science et génie des matériaux Bâtiment Maupertuis), Université d'Evry-Val-d'Essonne",Évry,Non trouvé,Non trouvé,Non trouvé,,
"IUT 2 - IUT 2 de Vienne, Université Grenoble Alpes (COMUE)",Vienne,Non trouvé,Non trouvé,Non trouvé,,
"IUT de Vannes, Université Bretagne Sud",Vannes,Non trouvé,Non trouvé,Non trouvé,,
"IUT de Valence, Université Pierre Mendès France - Grenoble 2",Valence,Non trouvé,Non trouvé,Non trouvé,,
"IUT de Troyes, Université de Reims Champagne-Ardenne",Troyes,Non trouvé,Non trouvé,Non trouvé,,
IUT de Ville d'Avray (Nanterre),Nanterre,Non trouvé,Non trouvé,Non trouvé,,
IUT de Ville d’Avray (Ville d'Avray),Nanterre,Non trouvé,Non trouvé,Non trouvé,,
IUT de Ville d’Avray (St Cloud),Nanterre,Non trouvé,Non trouvé,Non trouvé,,
IUT de Vélizy,Versailles,Non trouvé,Non trouvé,Non trouvé,,
"IUT de Villetaneuse, Université Paris 13",Bobigny,Non trouvé,Non trouvé,Non trouvé,,
"IUT de Tours, Université de Tours",Tours,Non trouvé,Non trouvé,Non trouvé,,
"IUT de Tarbes, Université Toulouse III",Tarbes,Non trouvé,Non trouvé,Non trouvé,,
"IUT de Toulon site de Draguignan, Université du Sud Toulon - Var",Toulon,Non trouvé,Non trouvé,Non trouvé,,
"IUT de Thionville-Yutz, Université Paul Verlaine de Metz",Metz,Non trouvé,Non trouvé,Non trouvé,,
"IUT de Toulon et du Var, Université du Sud Toulon - Var",Toulon,Non trouvé,Non trouvé,Non trouvé,,
"IUT de Toulon site de Saint-Raphael, Université du Sud Toulon - Var",Toulon,Non trouvé,Non trouvé,Non trouvé,,
"IUT - ULCO - IUT de St Omer, Université du Littoral - Côte d'Opale",Arras,Non trouvé,Non trouvé,Non trouvé,,
"IUT des Pays de l'Adour - Pau, Université Pau et Pays de l'Adour",Pau,Non trouvé,Non trouvé,Non trouvé,,
"IUT de Sceaux, Université Paris-Sud 11",Sceaux,Non trouvé,Non trouvé,Non trouvé,,
"IUT de Salon-de-Provence-antenne IUT Marseille, Université Paul Cézanne - Aix-Marseille III",Aix-en-Provence,Non trouvé,Non trouvé,Non trouvé,,
"IUT de Tremblay, Université Vincennes-Saint-Denis",Bobigny,Non trouvé,Non trouvé,Non trouvé,,
"IUT Cambrai UVH - IUT de Valenciennes, antenne de Cambrai UVHC, Université de Valenciennes",Lille,Non trouvé,Non trouvé,Non trouvé,,
"IUT de Seine et Marne Sud (site Fontainebleau), Université Paris-Est Créteil Val-de-Marne",Melun,Non trouvé,Non trouvé,Non trouvé,,
"IUT de Seine et Marne Sud (site Sénart), Université Paris-Est Créteil Val-de-Marne",Melun,Non trouvé,Non trouvé,Non trouvé,,
"IUT Val. UVHC - IUT de Valenciennes UVHC, Université de Valenciennes",Lille,Non trouvé,Non trouvé,Non trouvé,,
"IUT de Saint-Nazaire, Université de Nantes",Nantes,Non trouvé,Non trouvé,Non trouvé,,
"IUT des Pays de l'Adour - Mont de Marsan, Université Pau et Pays de l'Adour",Mont-de-Marsan,Non trouvé,Non trouvé,Non trouvé,,
"IUT de Saint-Malo, Université Rennes 1",Rennes,Non trouvé,Non trouvé,Non trouvé,,
"IUT de Saint-Etienne, Université Jean Monnet de Saint-Etienne",Saint-Étienne,Non trouvé,Non trouvé,Non trouvé,,
"IUT de Saint-Denis (site La Plaine St-Denis), Université Paris 13",Bobigny,Non trouvé,Non trouvé,Non trouvé,,
"IUT de Rodez, Université Toulouse I Capitole",Rodez,Non trouvé,Non trouvé,Non trouvé,,
"IUT de Roanne, Université Jean Monnet de Saint-Etienne",Saint-Étienne,Non trouvé,Non trouvé,Non trouvé,,
"IUT de Rennes, Université Rennes 1",Rennes,Non trouvé,Non trouvé,Non trouvé,,
"IUT de Reims Châlons Charleville, Université de Reims Champagne-Ardenne",Reims,Non trouvé,Non trouvé,Non trouvé,,
IUT de Saint-Dié - Université de Lorraine,Saint-Dié-des-Vosges,Non trouvé,Non trouvé,Non trouvé,,
"IUT de Reims, Châlons, Charleville, Université de Reims Champagne-Ardenne",Reims,Non trouvé,Non trouvé,Non trouvé,,
"IUT de Reims, Châlons, Charleville, Université de Reims Champagne-Ardenne",Charleville-Mézières,Non trouvé,Non trouvé,Non trouvé,,
"IUT de Provence - site d'Arles, Université Aix-Marseille I",Aix-en-Provence,Non trouvé,Non trouvé,Non trouvé,,
"IUT de Perpignan université de Perpignan, Université de Perpignan Via Domitia",Perpignan,Non trouvé,Non trouvé,Non trouvé,,
"IUT d'Epinal - Hubert Curien, Nancy-Université - Nancy 2",Nancy,Non trouvé,Non trouvé,Non trouvé,,
"IUT de Provence - site de Digne-les-Bains, Université Aix-Marseille I",Digne-les-Bains,Non trouvé,Non trouvé,Non trouvé,,
"IUT de Saint-Brieuc, Université Rennes 1",Saint-Brieuc,Non trouvé,Non trouvé,Non trouvé,,
"IUT de Saint-Denis, Université Paris 13",Bobigny,Non trouvé,Non trouvé,Non trouvé,,
"IUT de Quimper, Université de Bretagne Occidentale",Quimper,Non trouvé,Non trouvé,Non trouvé,,
"IUT de Perpignan antenne de Narbonne, Université de Perpignan Via Domitia",Carcassonne,Non trouvé,Non trouvé,Non trouvé,,
"IUT de Perpignan antenne de Carcassonne, Université de Perpignan Via Domitia",Carcassonne,Non trouvé,Non trouvé,Non trouvé,,
"IUT de Nîmes, Université Montpellier II",Nîmes,Non trouvé,Non trouvé,Non trouvé,,
"IUT de Nice Côte d'Azur - Site de Cannes - Département Tech de commercialisation, Université de Nice - Sophia Antipolis",Nice,Non trouvé,Non trouvé,Non trouvé,,
"IUT de Nice Côte d'Azur - Site de Menton, Université de Nice - Sophia Antipolis",Nice,Non trouvé,Non trouvé,Non trouvé,,
"IUT de Nice Côte d'Azur Antenne de Sophia-Antipolis, Université de Nice - Sophia Antipolis",Nice,Non trouvé,Non trouvé,Non trouvé,,
"IUT de Nantes, Université de Nantes",Nantes,Non trouvé,Non trouvé,Non trouvé,,
"IUT de Mulhouse, Université de Haute Alsace Mulhouse",Colmar,Non trouvé,Non trouvé,Non trouvé,,
"IUT de Moselle-Est, site de Saint -Avold, Université Paul Verlaine de Metz",Metz,Non trouvé,Non trouvé,Non trouvé,,
"IUT de Moselle-Est, site de Forbach, Université Paul Verlaine de Metz",Metz,Non trouvé,Non trouvé,Non trouvé,,
"IUT de Montpellier, Université Montpellier II",Montpellier,Non trouvé,Non trouvé,Non trouvé,,
"IUT de Montreuil, Université Vincennes-Saint-Denis",Bobigny,Non trouvé,Non trouvé,Non trouvé,,
"IUT de Montluçon - Moulins, Université Blaise Pascal, Université Clermont-Ferrand II",Moulins,Non trouvé,Non trouvé,Non trouvé,,
"IUT de Marseille, Université Paul Cézanne - Aix-Marseille III",Marseille,Non trouvé,Non trouvé,Non trouvé,,
"IUT de Marne-la-Vallée (site Meaux), Université Paris-Est Marne-La-Vallée",Melun,Non trouvé,Non trouvé,Non trouvé,,
"IUT de Paris Diderot, Université Paris Diderot",Paris,Non trouvé,Non trouvé,Non trouvé,,
IUT - IUT de Nice côte d'Azur - Site de Cannes - Département Information- Communication,Nice,Non trouvé,Non trouvé,Non trouvé,,
"IUT de Moselle-Est, site de Sarreguemines, Université Paul Verlaine de Metz",Sarreguemines,Non trouvé,Non trouvé,Non trouvé,,
"IUT de Nice Côte d'Azur, Université de Nice - Sophia Antipolis",Nice,Non trouvé,Non trouvé,Non trouvé,,
"IUT de Marne-La-Vallée (site Champs-sur-Marne), Université Paris-Est Marne-La-Vallée",Melun,Non trouvé,Non trouvé,Non trouvé,,
"IUT de Lorient, Université Bretagne Sud",Vannes,Non trouvé,Non trouvé,Non trouvé,,
"IUT de Montpellier - antenne de Sète, Université Montpellier II",Montpellier,Non trouvé,Non trouvé,Non trouvé,,
"IUT de Metz, Université Paul Verlaine de Metz",Metz,Non trouvé,Non trouvé,Non trouvé,,
"IUT de Montluçon - Université Blaise Pascal, Université Clermont-Ferrand II",Moulins,Non trouvé,Non trouvé,Non trouvé,,
"IUT de l'Oise site de Creil, Université Picardie Jules Verne Amiens",Compiègne,Non trouvé,Non trouvé,Non trouvé,,
"IUT Lens Artois - IUT de Lens Université d'Artois, Université d'Artois",Arras,Non trouvé,Non trouvé,Non trouvé,,
"IUT de l'Oise site de Beauvais, Université Picardie Jules Verne Amiens",Compiègne,Non trouvé,Non trouvé,Non trouvé,,
"IUT de Lorient (site de Pontivy), Université Bretagne Sud",Vannes,Non trouvé,Non trouvé,Non trouvé,,
"IUT de Laval, Université du Mans",Laval,Non trouvé,Non trouvé,Non trouvé,,
"IUT de l'Indre, Université d'Orléans",Châteauroux,Non trouvé,Non trouvé,Non trouvé,,
IUT de Mantes en Yvelines,Versailles,Non trouvé,Non trouvé,Non trouvé,,
"IUT de La Roche sur Yon, Université de Nantes",La Roche-sur-Yon,Non trouvé,Non trouvé,Non trouvé,,
"IUT de Lannion, Université Rennes 1",Saint-Brieuc,Non trouvé,Non trouvé,Non trouvé,,
"IUT de l'Aisne site de Saint-Quentin, Université Picardie Jules Verne Amiens",Laon,Non trouvé,Non trouvé,Non trouvé,,
"IUT de l'Aisne site de Laon, Université Picardie Jules Verne Amiens",Laon,Non trouvé,Non trouvé,Non trouvé,,
"IUT de Gap - antenne IUT Aix-en-Provence, Université Aix-Marseille II",Gap,Non trouvé,Non trouvé,Non trouvé,,
"IUT de Figeac, Université Toulouse II",Cahors,Non trouvé,Non trouvé,Non trouvé,,
"IUT - ULCO - IUT de Dunkerque, Université du Littoral - Côte d'Opale",Lille,Non trouvé,Non trouvé,Non trouvé,,
"IUT de Créteil-Vitry (site Vitry), Université Paris-Est Créteil Val-de-Marne",Créteil,Non trouvé,Non trouvé,Non trouvé,,
"IUT de Corse, Université de Corse",Corte,Non trouvé,Non trouvé,Non trouvé,,
"IUT de Clermont-Ferrand - Aurillac, Université d'Auvergne, Université Clermont-Ferrand I",Aurillac,Non trouvé,Non trouvé,Non trouvé,,
"IUT de l'Aisne site de Soissons, Université Picardie Jules Verne Amiens",Laon,Non trouvé,Non trouvé,Non trouvé,,
"IUT de Clermont-Ferrand - Aubière, Université d'Auvergne, Université Clermont-Ferrand I",Clermont-Ferrand,Non trouvé,Non trouvé,Non trouvé,,
"IUT de Créteil-Vitry (site Créteil), Université Paris-Est Créteil Val-de-Marne",Créteil,Non trouvé,Non trouvé,Non trouvé,,
"IUT de Haguenau, Université de Strasbourg",Strasbourg,Non trouvé,Non trouvé,Non trouvé,,
"IUT de Clermont-Ferrand - Le Puy-en-Velay, Université d'Auvergne, Université Clermont-Ferrand I",Le Puy-en-Velay,Non trouvé,Non trouvé,Non trouvé,,
"IUT de La Ciotat - Antenne de l'IUT d'Aix-en-Provence, Université Aix-Marseille II",Aix-en-Provence,Non trouvé,Non trouvé,Non trouvé,,
"IUT de Colmar, Université de Haute Alsace Mulhouse",Colmar,Non trouvé,Non trouvé,Non trouvé,,
"IUT de Cherbourg Manche, Université de Caen Basse-Normandie",Saint-Lô,Non trouvé,Non trouvé,Non trouvé,,
"IUT de Cherbourg Manche antenne de St-Lô, Université de Caen Basse-Normandie",Saint-Lô,Non trouvé,Non trouvé,Non trouvé,,
"IUT de Cergy (site Saint-Christophe), Université de Cergy-Pontoise",Cergy,Non trouvé,Non trouvé,Non trouvé,,
"IUT de Chambéry, Université de Savoie",Chambéry,Non trouvé,Non trouvé,Non trouvé,,
"IUT de Cergy (site Argenteuil), Université de Cergy-Pontoise",Cergy,Non trouvé,Non trouvé,Non trouvé,,
"IUT de Cergy (site Neuville), Université de Cergy-Pontoise",Cergy,Non trouvé,Non trouvé,Non trouvé,,
"IUT - ULCO - IUT de Calais, Université du Littoral - Côte d'Opale",Arras,Non trouvé,Non trouvé,Non trouvé,,
"IUT de Caen antenne Vire département TC, Université de Caen Basse-Normandie",Caen,Non trouvé,Non trouvé,Non trouvé,,
"IUT de Caen antenne de Lisieux, Université de Caen Basse-Normandie",Caen,Non trouvé,Non trouvé,Non trouvé,,
"IUT de Chartres, Université d'Orléans",Orléans,Non trouvé,Non trouvé,Non trouvé,,
"IUT de Béziers, Université Montpellier II",Montpellier,Non trouvé,Non trouvé,Non trouvé,,
"IUT de Caen antenne Vire département HSE, Université de Caen Basse-Normandie",Caen,Non trouvé,Non trouvé,Non trouvé,,
"IUT Artois - IUT de Béthune université d'Artois, Université d'Artois",Arras,Non trouvé,Non trouvé,Non trouvé,,
"IUT de Caen antenne d'Ifs, Université de Caen Basse-Normandie",Caen,Non trouvé,Non trouvé,Non trouvé,,
"IUT de Brest, Université de Bretagne Occidentale",Quimper,Non trouvé,Non trouvé,Non trouvé,,
"IUT de Caen, Université de Caen Basse-Normandie",Caen,Non trouvé,Non trouvé,Non trouvé,,
"IUT de Cergy (site Saint-Martin), Université de Cergy-Pontoise",Cergy,Non trouvé,Non trouvé,Non trouvé,,
"IUT de Cergy (site Sarcelles), Université de Cergy-Pontoise",Cergy,Non trouvé,Non trouvé,Non trouvé,,
"IUT de Brest (site de Morlaix), Université de Bretagne Occidentale",Quimper,Non trouvé,Non trouvé,Non trouvé,,
"IUT de Bourges, Université d'Orléans",Bourges,Non trouvé,Non trouvé,Non trouvé,,
"IUT de Blois, Université de Tours",Blois,Non trouvé,Non trouvé,Non trouvé,,
"IUT de Blagnac, Université Toulouse II",Toulouse,Non trouvé,Non trouvé,Non trouvé,,
"IUT de Cachan, Université Paris-Sud 11",Créteil,Non trouvé,Non trouvé,Non trouvé,,
"IUT de Besançon-Vesoul, site de Besançon, Université de Franche-Comté",Besançon,Non trouvé,Non trouvé,Non trouvé,,
"IUT de Belfort-Montbeliard, site de Montbeliard, Université de Franche-Comté",Besançon,Non trouvé,Non trouvé,Non trouvé,,
"IUT de Besançon-Vesoul, site de Vesoul, Université de Franche-Comté",Vesoul,Non trouvé,Non trouvé,Non trouvé,,
"IUT - ULCO - IUT de Boulogne, Université du Littoral - Côte d'Opale",Arras,Non trouvé,Non trouvé,Non trouvé,,
"IUT de Bayonne, Pays Basque - Anglet, Université Pau et Pays de l'Adour",Pau,Non trouvé,Non trouvé,Non trouvé,,
"IUT de Bobigny, Université Paris 13",Bobigny,Non trouvé,Non trouvé,Non trouvé,,
"IUT de Bayonne, Pays Basque - Bayonne, Université Pau et Pays de l'Adour",Pau,Non trouvé,Non trouvé,Non trouvé,,
"IUT de Belfort-Montbeliard, site de Belfort, Université de Franche-Comté",Belfort,Non trouvé,Non trouvé,Non trouvé,,
"IUT d'Angers, Université d'Angers",Angers,Non trouvé,Non trouvé,Non trouvé,,
"IUT d'Amiens, Université Picardie Jules Verne Amiens",Amiens,Non trouvé,Non trouvé,Non trouvé,,
"IUT d'Annecy, Université de Savoie",Annecy,Non trouvé,Non trouvé,Non trouvé,,
"IUT d'Avignon, Université d'Avignon",Avignon,Non trouvé,Non trouvé,Non trouvé,,
"IUT d'Aix-en-Provence, Université Aix-Marseille II",Aix-en-Provence,Non trouvé,Non trouvé,Non trouvé,,
"IUT d'Aix en Provence Dép information-communication - métiers du livre, Université Aix-Marseille II",Aix-en-Provence,Non trouvé,Non trouvé,Non trouvé,,
"IUT d'Allier - Vichy, Université Blaise Pascal, Université Clermont-Ferrand II",Moulins,Non trouvé,Non trouvé,Non trouvé,,
"IUT Lille 3 - IUT B de l'université de Lille 3, Université Lille 3",Lille,Non trouvé,Non trouvé,Non trouvé,,
"IUT Bordeaux 1, Université Bordeaux I",Bordeaux,Non trouvé,Non trouvé,Non trouvé,,
"IUT C Lille 2 - IUT C de l'université de Lille 2 - Roubaix, Université de Lille 2",Lille,Non trouvé,Non trouvé,Non trouvé,,
"IUT d'Alençon, Université de Caen Basse-Normandie",Alençon,Non trouvé,Non trouvé,Non trouvé,,
"IUT d'Agen, Université Bordeaux I",Agen,Non trouvé,Non trouvé,Non trouvé,,
"IUT d'Aix en Provence département Carrières sociales, Université Aix-Marseille II",Aix-en-Provence,Non trouvé,Non trouvé,Non trouvé,,
"IUT A Lille 1, Université Lille 1 - Sciences et Technologies",Lille,Non trouvé,Non trouvé,Non trouvé,,
"IUT Bordeaux Montesquieu, Université Bordeaux IV",Bordeaux,Non trouvé,Non trouvé,Non trouvé,,
"IUT Maubeuge - Antenne de l'IUT de Valenciennes Maubeuge, Université de Valenciennes",Lille,Non trouvé,Non trouvé,Non trouvé,,
"Antenne de Cholet - IUT d'Angers, Université d'Angers",Angers,Non trouvé,Non trouvé,Non trouvé,,
Oxford Brookes University,,Non trouvé,Non trouvé,Non trouvé,,